<?xml version="1.0"?>
<!--<!DOCTYPE company
        [
                <!ELEMENT company (staff, staff)>
                <!ELEMENT staff (firstname,lastname,nickname,salary)>
                <!ATTLIST staff id CDATA "0">
                <!ELEMENT firstname (#PCDATA)>
                <!ELEMENT lastname (#PCDATA)>
                <!ELEMENT nickname (#PCDATA)>
                <!ELEMENT salary (#PCDATA)>
                ]>-->
<company
        xmlns="xsdTest"
        xmlns:xsi="http://www.w3.org/2001/XMLSchema-instance"
        xsi:schemaLocation="xsdTest staff1.xsd">
    <staff id="1001">
        <firstname>22</firstname>
        <lastname>mook kim</lastname>
        <nickname>mkyong</nickname>
        <salary>100000</salary>
    </staff>
    <staff id="2001">
        <firstname>low</firstname>
        <lastname>yin fong</lastname>
        <nickname>fong fong</nickname>
        <salary>200000</salary>
    </staff>
</company>

